{
    "id": 1,
    "name": "カテゴリ1",
    "category_name": "サンプル商品",
    "hierarchy": 1,
    "sort_no": 1,
    "create_date": "2024-01-01T00:00:00+09:00",
    "update_date": "2024-01-01T00:00:00+09:00",
    "product_categorys": [
        {
            "id": 1,
            "name": "サンプルProductCategory"
        }
    ],
    "categorys": [
        {
            "id": 1,
            "name": "サンプルCategory"
        }
    ],
    "category": {
        "id": 1,
        "name": "サンプルCategory"
    },
    "member": {
        "id": 1,
        "name": "サンプルMember"
    }
}